{
  "$schema": "reference-candidates.schema.json",
  "frame_version": 2,
  "status": "frozen_before_solicitation",
  "retrieved_at": "2026-07-25T16:16:46.980265Z",
  "amendment_sha256": "c790489b5b97bf4c2d3bb3850d6ed1d948c5461e7f6ce68fd2eb43330d8ae7a2",
  "target_manifest_sha256": "e2d4c7b90fb1276fc979935b60628eafb9c053f4f5a971df115eb3f6fab23238",
  "reference_manifest_sha256": "91add8eca57f393fb6b1e439af86179718dbb1564a411fae172e173855c3b3c1",
  "selection": {
    "queries": {
      "Python": "language:Python fork:false archived:false created:<2024-01-01 pushed:>=2025-01-01 size:500..50000 stars:20..2000",
      "Go": "language:Go fork:false archived:false created:<2024-01-01 pushed:>=2025-01-01 size:500..50000 stars:20..2000"
    },
    "github_sort": "stars_descending",
    "github_page_size": 100,
    "final_order": "sha256(proposed_label + NUL + language + NUL + lowercase_repository_id)",
    "classifier_outputs_consulted": false,
    "source_features_consulted": false
  },
  "candidates": [
    {
      "id": "chinesehuazhou/python-weekly",
      "url": "https://github.com/chinesehuazhou/python-weekly",
      "language": "Python",
      "proposed_label": "human",
      "source": "github_search",
      "content_group": "chinesehuazhou/python-weekly",
      "metadata": {
        "created_at": "2023-05-13T09:37:13Z",
        "pushed_at": "2026-07-25T12:58:45Z",
        "stars": 1885,
        "disk_kib": 5106,
        "has_issues": true,
        "owner_type": "User",
        "is_fork": false,
        "is_archived": false
      },
      "solicitation_status": "unsolicited",
      "selection_key": "0066e279cde879b7c06cfb233e8d1147eeefb090822d5350f3dbf343be4ae8b7"
    },
    {
      "id": "timbrel/GitSavvy",
      "url": "https://github.com/timbrel/GitSavvy",
      "language": "Python",
      "proposed_label": "human",
      "source": "github_search",
      "content_group": "timbrel/GitSavvy",
      "metadata": {
        "created_at": "2015-01-18T05:40:08Z",
        "pushed_at": "2026-07-23T17:48:57Z",
        "stars": 1943,
        "disk_kib": 5476,
        "has_issues": true,
        "owner_type": "Organization",
        "is_fork": false,
        "is_archived": false
      },
      "solicitation_status": "unsolicited",
      "selection_key": "0255a5a294b71b0e1d3780cac01a2ddad2689274f6500143024f5b76c10ccdba"
    },
    {
      "id": "faust-streaming/faust",
      "url": "https://github.com/faust-streaming/faust",
      "language": "Python",
      "proposed_label": "human",
      "source": "github_search",
      "content_group": "faust-streaming/faust",
      "metadata": {
        "created_at": "2020-10-22T15:32:50Z",
        "pushed_at": "2026-07-23T07:20:20Z",
        "stars": 1879,
        "disk_kib": 10512,
        "has_issues": true,
        "owner_type": "Organization",
        "is_fork": false,
        "is_archived": false
      },
      "solicitation_status": "unsolicited",
      "selection_key": "0365876fa190d1a0363c8714bab8981eab5c9edde44575018a88d3b02796094d"
    },
    {
      "id": "fwdcloudsec/granted",
      "url": "https://github.com/fwdcloudsec/granted",
      "language": "Go",
      "proposed_label": "human",
      "source": "github_search",
      "content_group": "fwdcloudsec/granted",
      "metadata": {
        "created_at": "2022-02-14T16:35:35Z",
        "pushed_at": "2026-07-23T12:55:42Z",
        "stars": 1743,
        "disk_kib": 2394,
        "has_issues": true,
        "owner_type": "Organization",
        "is_fork": false,
        "is_archived": false
      },
      "solicitation_status": "unsolicited",
      "selection_key": "044a8cdd9171a1cc2037848fd0c4e70d04afef899f338cb0af81ab5d2c20f98a"
    },
    {
      "id": "sourcegraph/zoekt",
      "url": "https://github.com/sourcegraph/zoekt",
      "language": "Go",
      "proposed_label": "human",
      "source": "github_search",
      "content_group": "sourcegraph/zoekt",
      "metadata": {
        "created_at": "2018-10-01T20:58:06Z",
        "pushed_at": "2026-07-24T15:08:33Z",
        "stars": 1786,
        "disk_kib": 15598,
        "has_issues": true,
        "owner_type": "Organization",
        "is_fork": false,
        "is_archived": false
      },
      "solicitation_status": "unsolicited",
      "selection_key": "04f1a8baf27a2635b4094800018d9363cf7e8433d13974d1760ec896d51211a5"
    },
    {
      "id": "aws/aws-node-termination-handler",
      "url": "https://github.com/aws/aws-node-termination-handler",
      "language": "Go",
      "proposed_label": "human",
      "source": "github_search",
      "content_group": "aws/aws-node-termination-handler",
      "metadata": {
        "created_at": "2019-10-21T17:57:15Z",
        "pushed_at": "2026-07-21T22:42:37Z",
        "stars": 1761,
        "disk_kib": 2042,
        "has_issues": true,
        "owner_type": "Organization",
        "is_fork": false,
        "is_archived": false
      },
      "solicitation_status": "unsolicited",
      "selection_key": "050ca4cd2d2500abb29d577aa943903a870ef8a2e58b11d359767a5721dce739"
    },
    {
      "id": "githubnemo/CompileDaemon",
      "url": "https://github.com/githubnemo/CompileDaemon",
      "language": "Go",
      "proposed_label": "human",
      "source": "github_search",
      "content_group": "githubnemo/CompileDaemon",
      "metadata": {
        "created_at": "2012-09-15T00:24:11Z",
        "pushed_at": "2026-05-06T09:51:39Z",
        "stars": 1724,
        "disk_kib": 1214,
        "has_issues": true,
        "owner_type": "User",
        "is_fork": false,
        "is_archived": false
      },
      "solicitation_status": "unsolicited",
      "selection_key": "050dcd6808f04cf77912afaa086d5df8704f202f3914ad24d8043a6e3f244e19"
    },
    {
      "id": "norwoodj/helm-docs",
      "url": "https://github.com/norwoodj/helm-docs",
      "language": "Go",
      "proposed_label": "human",
      "source": "github_search",
      "content_group": "norwoodj/helm-docs",
      "metadata": {
        "created_at": "2018-09-01T15:23:11Z",
        "pushed_at": "2026-06-22T09:25:43Z",
        "stars": 1755,
        "disk_kib": 4119,
        "has_issues": true,
        "owner_type": "User",
        "is_fork": false,
        "is_archived": false
      },
      "solicitation_status": "unsolicited",
      "selection_key": "05bd4a95d3e7a9acb80f61a227bd5a70cecfa06943c99b5057cd37c5439495d8"
    },
    {
      "id": "johannfaouzi/pyts",
      "url": "https://github.com/johannfaouzi/pyts",
      "language": "Python",
      "proposed_label": "human",
      "source": "github_search",
      "content_group": "johannfaouzi/pyts",
      "metadata": {
        "created_at": "2017-07-31T09:23:16Z",
        "pushed_at": "2025-06-18T15:41:19Z",
        "stars": 1875,
        "disk_kib": 7896,
        "has_issues": true,
        "owner_type": "User",
        "is_fork": false,
        "is_archived": false
      },
      "solicitation_status": "unsolicited",
      "selection_key": "06699e5e40af6113fa9e16d1258923079b7f3b370d5ca5ea1542f0890291a4a5"
    },
    {
      "id": "jimmc414/onefilellm",
      "url": "https://github.com/jimmc414/onefilellm",
      "language": "Python",
      "proposed_label": "human",
      "source": "github_search",
      "content_group": "jimmc414/onefilellm",
      "metadata": {
        "created_at": "2023-03-17T02:16:23Z",
        "pushed_at": "2026-06-12T19:40:26Z",
        "stars": 2000,
        "disk_kib": 1197,
        "has_issues": true,
        "owner_type": "User",
        "is_fork": false,
        "is_archived": false
      },
      "solicitation_status": "unsolicited",
      "selection_key": "06936e3fea662e1bf08780f12f3a1e17ae9fbb1985da195c318b4dbaa8255485"
    },
    {
      "id": "iBaa/PlexConnect",
      "url": "https://github.com/iBaa/PlexConnect",
      "language": "Python",
      "proposed_label": "human",
      "source": "github_search",
      "content_group": "iBaa/PlexConnect",
      "metadata": {
        "created_at": "2013-04-14T08:02:23Z",
        "pushed_at": "2026-06-15T18:50:27Z",
        "stars": 1906,
        "disk_kib": 19264,
        "has_issues": true,
        "owner_type": "User",
        "is_fork": false,
        "is_archived": false
      },
      "solicitation_status": "unsolicited",
      "selection_key": "07d1c93e2a24073564558c9b8ec2e01f37880f891756ca91c8799cde15bb5e31"
    },
    {
      "id": "AlexxIT/YandexStation",
      "url": "https://github.com/AlexxIT/YandexStation",
      "language": "Python",
      "proposed_label": "human",
      "source": "github_search",
      "content_group": "AlexxIT/YandexStation",
      "metadata": {
        "created_at": "2020-01-27T19:15:27Z",
        "pushed_at": "2026-07-17T09:45:26Z",
        "stars": 1893,
        "disk_kib": 2990,
        "has_issues": true,
        "owner_type": "User",
        "is_fork": false,
        "is_archived": false
      },
      "solicitation_status": "unsolicited",
      "selection_key": "0a2b20e63955bb5a014de0cc6a83f2c512083778cfa81994688fc875719cccd3"
    },
    {
      "id": "GitGuardian/ggshield",
      "url": "https://github.com/GitGuardian/ggshield",
      "language": "Python",
      "proposed_label": "human",
      "source": "github_search",
      "content_group": "GitGuardian/ggshield",
      "metadata": {
        "created_at": "2020-04-20T15:36:24Z",
        "pushed_at": "2026-07-24T14:45:13Z",
        "stars": 1973,
        "disk_kib": 9057,
        "has_issues": true,
        "owner_type": "Organization",
        "is_fork": false,
        "is_archived": false
      },
      "solicitation_status": "unsolicited",
      "selection_key": "0b59a895cb0e5c9ea32debfec3a4f99cde8ac776313dcc4a371ae947e255451a"
    },
    {
      "id": "Vchitect/Latte",
      "url": "https://github.com/Vchitect/Latte",
      "language": "Python",
      "proposed_label": "human",
      "source": "github_search",
      "content_group": "Vchitect/Latte",
      "metadata": {
        "created_at": "2023-10-28T09:14:10Z",